{
  "meta": {
    "schema_version": "1.0",
    "audit_ref": "carbon-v3.1-2026-04-08"
  },
  "report": {
    "executive_summary": "Carbon Design System scores 62.5/100 (not ready) with 6 dimension-level blockers. The system has mature governance (82.1/100), strong component quality (81.2/100), and an exceptionally rich variable system (1804 variables, 4 theme modes). However, Figma-side documentation is critically absent: 0% component descriptions carry functional intent, 0.3% of variables have descriptions, and no motion tokens exist in the design file. The single most important action is porting intent descriptions from code-side MDX docs to Figma component set root entries."
  },
  "clusters": {
    "0_prerequisites": {
      "narrative": "Carbon is an explicitly multi-platform system (web + iOS + Android) with documented platform strategy and clear information architecture.",
      "value_framing": "Platform strategy is clear and multi-platform scope is well-documented, enabling agents to determine platform targets without guessing."
    },
    "1_token_and_variable_system": {
      "narrative": "Exceptionally rich variable system (1804 variables, 34 collections, 3175 aliases) with four theme modes. Three-layer architecture present in code. Figma variable descriptions nearly absent (0.3%).",
      "value_framing": "Token architecture is rich in Figma (1804 variables, 4 themes) but near-zero descriptions mean an agent cannot determine token purpose from metadata alone, forcing inference from naming conventions and consuming excess tokens per interaction."
    },
    "2_component_quality": {
      "narrative": "Strong component architecture: 2856 published variants, comprehensive state coverage, TypeScript APIs, and meaningful token binding including spacing and typography on form components.",
      "value_framing": "Strong component architecture in both Figma and code enables reliable agent composition, but inconsistent token binding depth means some components are more theme-aware than others."
    },
    "3_documentation_readiness": {
      "narrative": "Severe split: code-side documentation is excellent (MDX, structured API docs, usage guidelines), but Figma-side descriptions are nearly absent (5.1% components, 0% sub-component doc frames). Co-location principle not satisfied: external docs exist but no declared path from Figma components.",
      "value_framing": "Without functional descriptions in Figma, every AI-assisted component selection requires a human to intervene and re-specify. The excellent code-side documentation is invisible to agents consuming only the Figma API."
    },
    "4_design_quality_baseline": {
      "narrative": "Strong baseline quality across most dimensions. Comprehensive type scale, spacing system, colour structure, and accessibility patterns. Motion tokens exist in code but not in Figma Variables. Empty state patterns absent.",
      "value_framing": "Strong baseline quality across most dimensions reduces agent correction cycles, but missing motion tokens in Figma and absent empty state patterns force case-by-case decisions."
    },
    "5_governance_and_ecosystem": {
      "narrative": "Mature governance: documented deprecation patterns with runtime warnings, comprehensive testing (unit + AVT + VRT), monorepo with clear contribution standards, and adoption tracking via @carbon/react npm.",
      "value_framing": "Mature governance with formal deprecation patterns, comprehensive testing, and documented contribution standards reduces agent errors from outdated or inconsistent patterns."
    },
    "6_design_to_code_parity": {
      "narrative": "Structural parity is strong (component naming, variant coverage) but token-level parity is difficult to assess due to different architectures. 518 code-only tokens, 1164 Figma-only tokens, no parity gap register.",
      "value_framing": "Undocumented parity gaps across 1682 tokens are silent error sources. Different token architectures between Figma and code are undocumented, blocking automated drift detection."
    }
  },
  "dimensions": {
    "0.1_platform_architecture_clarity": {
      "narrative": "Carbon is documented as a multi-platform system with web as primary and native guidelines published. The Figma file is web-focused but references cross-platform considerations. Platform strategy is discoverable from the docs site and file structure. An agent can determine platform targets without guessing."
    },
    "1.1_token_implementation": {
      "narrative": "1804 variables across 34 collections covering colour, spacing, typography, breakpoints, grid, layer, and component-specific tokens. All implemented as Figma Variables with mode support. Four theme modes (White, Gray 10, Gray 90, Gray 100). 342 styles (218 fills, 116 effects, 8 grids). Token coverage is comprehensive across all design property categories."
    },
    "1.2_alias_chain_integrity": {
      "narrative": "3175 alias references across 1804 variables (176% ratio, meaning most variables alias through multiple hops). Theme collection (548 vars) aliases to Colors primitives (135 vars). Component-specific collections alias to Theme. However, code-side component tokens in packages/themes/src/component-tokens use hardcoded hex values rather than aliasing semantic tokens, breaking the three-layer chain at the component level."
    },
    "1.3_token_architecture_depth": {
      "narrative": "Three layers confirmed in both Figma and code. Primitives: Colors collection (135 vars) + Type Primitives (329 vars). Semantic: Theme collection (548 vars) with four modes. Component: dedicated collections (Button, Content Switcher, etc.) and contextual variables. Code mirrors this with @carbon/colors (primitives), @carbon/themes (semantic), and component-tokens/ (component). Minor gap: code-side component tokens hardcode hex values instead of aliasing semantic tokens."
    },
    "1.4_primitive_naming": {
      "narrative": "Full words throughout. Color primitives use hue+step convention (blue60, gray10). Spacing uses numbered scale (spacing-01 through spacing-13). Typography uses role-based names (body-compact-01, heading-03). Consistent within categories. The hue+step pattern for primitives is functional but not fully intent-based."
    },
    "1.5_token_format_machine_readability": {
      "narrative": "Code-side tokens are JS module exports with computed values (rem(), miniUnits(), adjustAlpha()). SCSS generated via @carbon/scss-generator. No DTCG or Style Dictionary interop. Format is machine-readable but requires Carbon-specific tooling to parse. An AI agent needs custom extraction logic rather than standard token tooling."
    },
    "1.6_token_documentation": {
      "narrative": "5 of 1804 variables (0.3%) have descriptions in Figma. This is worse than MUI (18.4%). No variable descriptions on the Colors primitives (135 vars), Theme semantics (548 vars), spacing, typography, or breakpoints collections. Without descriptions, an agent cannot determine token purpose from the variable data alone."
    },
    "2.1_component_to_token_binding": {
      "narrative": "MCP spot-check of Tag (Purple, Small, Enabled) shows color fills bound to variables (tag-background, tag-color, tag-border-operational) and typography via label-01 style. Accordion shows text bound to text-primary, border to border-subtle-background, typography via body-01 style with full font specs. Button triggered Code Connect prompt suggesting minimal native bindings. Token binding is present but inconsistent across components: form components (Text Input, Accordion) show richer binding than atomic components (Button, Tag)."
    },
    "2.2_component_api_composability": {
      "narrative": "Full TypeScript with exported interfaces. ButtonBaseProps extends React.ButtonHTMLAttributes. Polymorphic 'as' prop via PolymorphicComponentPropWithRef. Constrained enums (ButtonKinds, ButtonSizes as const arrays with derived union types). Composable renderIcon prop accepts React.ElementType. Dual PropTypes + TypeScript typing. 126 components under @carbon/react."
    },
    "2.3_variant_completeness": {
      "narrative": "2856 published components with exhaustive variant coverage. Button alone has 420 variants across Style (Primary, Secondary, Tertiary, Danger, Ghost, Danger ghost), Type (Text, Text + Icon, Icon only), Size (Small, Medium, Large, Extra large, 2X large, Expressive), and State (Enabled, Hover, Focus, Active, Disabled, Skeleton). Interactive states consistently defined. 4047 total variants across 196 component sets."
    },
    "2.4_escape_hatch_usage": {
      "narrative": "Carbon's API design constrains customisation through typed props and constrained enums. className is accepted on all components (standard React pattern). No sx prop or style prop abuse detected in examples. The design system's coding style guide in developer-handbook.md establishes BEM naming conventions that discourage direct style overrides."
    },
    "3.1_component_description_coverage": {
      "narrative": "147 of 2856 components (5.1%) have any description in Figma. All 147 are spec implementation notes on Tree View variants ('Follow specs for levels...'), not functional intent. No component has an intent-carrying description. The code-side MDX documentation is excellent but is not accessible through the Figma API. Per the v3.0 co-location principle, external documentation with no declared path from the component scores lower \u2014 Carbon has no link fields or CLAUDE.md declarations bridging Figma components to code docs."
    },
    "3.2_documentation_structure_machine_readability": {